PSC CODE,length,PRODUCT AND SERVICE CODE NAME,START DATE,END DATE,PRODUCT AND SERVICE CODE FULL NAME,PRODUCT AND SERVICE CODE EXCLUDES,PRODUCT AND SERVICE CODE NOTES,PRODUCT AND SERVICE CODE INCLUDES
10,2,WEAPONS,1979-10-01,,,,"This group includes combat weapons as well as weapon-like noncombat items, such as line throwing devices and pyrotechnic pistols.  Also included in this group are weapon neutralizing equipment, such as degaussers, and deception equipment, such as camouflage nets.  Excluded from this group are fire control and night devices classifiable in groups 12 or 58.",
1005,4,"GUNS, THROUGH 30MM",2011-10-01,,"Guns, through 30 mm","Turrets, Aircraft.",,"Machine guns; Brushes, Machine Gun and Pistol."
1010,4,"GUNS, OVER 30MM UP TO 75MM",2011-10-01,,"Guns, over 30 mm up to 75 mm",,,"Breech Mechanisms; Mounts Grenade Launchers for Integral-Cartridge Grenades, Single-Shot or Auto-Loading or Automatic-Firing."
1015,4,"GUNS, 75MM THROUGH 125MM",2011-10-01,,"Guns, 75 mm through 125 mm",,,Breech Mechanisms; Mounts; Rammers.
1020,4,"GUNS, OVER 125MM THROUGH 150MM",2011-10-01,,"Guns, over 125 mm through 150 mm Includes Breech Mechanisms, Power Drives; Gun Shields.",,,"Includes Breech Mechanisms, Power Drives; Gun Shields."
1025,4,"GUNS, OVER 150MM THROUGH 200MM",2011-10-01,,"Guns, over 150 mm through 200 mm Includes Firing Platforms; Mounts; Gun Shields.",,,[Firing Platforms; Mounts; Gun Shields.]
1030,4,"GUNS, OVER 200MM THROUGH 300MM",2011-10-01,,"Guns, over 200 mm through 300 mm Includes Gun Yokes; Rammers; Reflectors.",,,Includes Gun Yokes; Rammers; Reflectors.
1035,4,"GUNS, OVER 300MM",2011-10-01,,"Guns, over 300 mm",,,Breech Mechanisms; Training Gears; Power Drives.
1040,4,CHEMICAL WEAPONS AND EQUIPMENT,1978-10-15,,Chemical Weapons and Equipment,,,Flame Throwers; Smoke Generators.
1045,4,"LAUNCHERS, TORPEDO AND DEPTH CHARGE",1978-10-15,,"Launchers, Torpedo and Depth Charge",,,Depth Charge Tracks; Torpedo Tubes.
1055,4,"LAUNCHERS, ROCKET AND PYROTECHNIC",1978-10-15,,"Launchers, Rocket and Pyrotechnic","Specifically designed Airborne Guided Missile  Launchers; Jettisonable Rocket Launchers; Launcher Fairings designed for specific airframes; Rifle Grenade Launchers; Grenade Launchers for Integral-Cartridge Grenades, Single-Shot or Auto Loading or Automatic Firing.",,Airborne Rocket Launchers adaptable to guided missile use.
1070,4,"NETS AND BOOMS, ORDNANCE",1978-12-15,,"Nets and Booms, Ordnance",,This class includes nets and booms for harbor  defense only.,
1075,4,DEGAUSSING AND MINE SWEEPING EQUIPMENT,2011-10-01,,Degaussing and Mine Sweeping Equipment,,,
1080,4,CAMOUFLAGE AND DECEPTION EQUIPMENT,1978-10-15,,Camouflage and Deception Equipment,,,"Dummy Artillery, Aircraft and Vehicles; Garnished Nets."
1090,4,ASSEMBLIES INTERCHANGEABLE BETWEEN WEAPONS IN TWO OR MORE CLASSES,2011-10-01,,Assemblies Interchangeable Between Weapons in Two or More  Classes,,,Components and Accessories used on or with weapons falling in two or more classes of [G]group 10.
1095,4,MISCELLANEOUS WEAPONS,1978-10-15,,Miscellaneous Weapons,,,"Line Throwing Guns; Catapult Guns; Bayonets; Saluting Guns; Signal Guns; Flare Guns; Barrage Balloons; Accessories, not elsewhere classifiable, for Weapons in this group; Expendable Bomb Dispensers."
11,2,NUCLEAR ORDNANCE,1979-10-01,,,,"This group includes, in particular, nuclear  ordnance training weapons, practice ballistic units, and all components specially designed therefore, when not specifically classified elsewhere.  Also included in the group are specially designed simulators and mockups, which are  integral parts of the above.  Excluded from this group  are general purpose nose cones, case sections, flare  sections or center sections designed to carry payloads  other than nuclear and/or for use on a missile, rocket,  or re-entry vehicle to attain the necessary aerodynamic  configuration.",
1105,4,NUCLEAR BOMBS,1978-12-15,,Nuclear Bombs,Parachute canopies and canopy hardware.,"This class includes nuclear weapons (including bombs), which are designed to be dropped from an aircraft.","Ballistic cases, tail assemblies, retardation devices, and other peculiar components which are not  classifiable elsewhere."
1110,4,NUCLEAR PROJECTILES,1980-01-15,,Nuclear Projectiles,,"This class includes nuclear weapons which are designed to be propelled from a recoilless rifle, gun,  howitzer, or the like, and which are not designed to be  self propelled.","Ogive sections, body sections, bases, and other peculiar components which are not classifiable elsewhere."
1115,4,NUCLEAR WARHEADS AND WARHEAD SECTIONS,2011-10-01,,Nuclear Warheads and Warhead  Sections,"Such components as fuzing and firing devices,  nuclear components, high explosive components, classifiable in more specific classes, and items such as projectiles  and bombs which include the entire outer case of a weapon.","This class includes nuclear warheads (without or assembled with case sections, adaption kits, and/or fuzing and firing components) which are to be used in or with bombs, rockets, projectiles, missiles, demolition charges, or the like.  Also includes case sections, nose cones,  flare sections, center sections, and auxiliary structural components of missiles, rockets, and re-entry vehicles  which are designed or constructed for exclusive use with or for housing of nuclear warheads and/or warhead sections.","Components and parts peculiar to the warhead or warhead section, which are not classifiable in more specific classes."
1120,4,NUCLEAR DEPTH CHARGES,1985-01-15,,Nuclear Depth Charges,,This class includes nuclear weapons which consist  of depth charge bodies assembled with nuclear warheads.  It includes training weapons and all specially designed  components which are not classifiable elsewhere.,
1125,4,NUCLEAR DEMOLITION CHARGES,1991-10-01,,Nuclear Demolition Charges,,"This class includes nuclear weapons which are designed to be emplaced in or near a structure, area or  the like, which is to be destroyed.  The weapons may include accessories.","Outer cases, case sections and other peculiar  components, which are not classifiable elsewhere."
1127,4,NUCLEAR ROCKETS,1982-09-15,,Nuclear Rockets,Rocket Motors; Warhead Components; Rocket  Components classified in other FSC classes.,"This class includes nuclear weapons, consisting of rocket bodies assembled with nuclear warheads,  which comprise a single item of supply and are issued as such.",Components peculiar to assembled rockets which are not classifiable elsewhere.
1130,4,"CONVERSION KITS, NUCLEAR ORDNANCE",1979-06-15,,"Conversion Kits, Nuclear Ordnance",,This class Includes collections of items used for the purpose of  converting nuclear weapons from one configuration to another.,
1135,4,"FUZING AND FIRING DEVICES, NUCLEAR ORDNANCE",2011-10-01,,"Fuzing and Firing Devices, Nuclear Ordnance",,,"Such items as fuzes, power supplies, firing sets, X-units, cables, safing devices, adaption kits, and  re-entry vehicle nuclear ordnance arming and fuzing systems."
1140,4,NUCLEAR COMPONENTS,1978-10-15,,Nuclear Components,"End items, such as bombs, projectiles, warheads, and the like.",,All components which contain or simulate nuclear active materials.
1145,4,"EXPLOSIVE AND PYROTECHNIC COMPONENTS, NUCLEAR ORDNANCE",2011-10-01,,"Explosive and Pyrotechnic Components, Nuclear Ordnance",,"This class includes actual and simulated explosive and pyrotechnic components peculiar to all nuclear ordnance end items such as bombs, demolition charges, rockets, projectiles, warheads, and related systems.  Excluded from this class are all explosive and pyrotechnic components designed for other than nuclear ordnance applications.",
1190,4,"SPECIALIZED TEST AND HANDLING EQUIPMENT, NUCLEAR ORDNANCE",2011-10-01,,"Specialized Test and Handling Equipment, Nuclear Ordnance","Hand tools; Instruments for use on both nuclear ordnance and other equipment; Basic types of electrical and electronic test instruments, including those specially designed, such as ammeters, voltmeters, ohmmeters, multimeters, and similar instruments, as shown in the indexes in the FSC.",,"Specially designed trucks and trailers for nuclear ordnance; Specially designed slings and hoists; Operational, test, and setting devices, and cradles; Conditioning Kits and Sets, Controlled Environment."
1195,4,MISCELLANEOUS NUCLEAR ORDNANCE,1978-10-15,,Miscellaneous Nuclear Ordnance,,,Items common to more than one class or items not properly fitting into the foregoing classes of nuclear ordnance
12,2,FIRE CONTROL EQPT.,1979-10-01,,,,"Fire Control assemblies, subassemblies, and components are classified: a.  In appropriate classes of this group when:  (1)  Designed for multiple applications to different kinds of fire control equipment. (2)  Modified for use with guided missile remote control systems. (3)  Designed specifically for shipborne guided missile  remote control systems. (4)  Radar equipment, designed specifically for fire control systems. (5)  Both day and night viewing characteristics are incorporated into an integral unit.  b.  In class 1270 or 1280, when designed specifically for  aircraft gunnery or aircraft bombing fire control,  respectively.  c.  In class 1430, when designed specifically for guided missile remote control systems, except shipboard type. d.  In appropriate classes of group 58, when designed for  multiple applications to both fire control and  communication equipment. e.  In appropriate classes of group 58 when designed for night vision.",
1210,4,FIRE CONTROL DIRECTORS,1978-10-15,,Fire Control Directors,,,
1220,4,FIRE CONTROL COMPUTING SIGHTS AND DEVICES,2011-10-01,,Fire Control Computing Sights and Devices,,,
1230,4,"FIRE CONTROL SYSTEMS, COMPLETE",1978-10-15,,"Fire Control Systems, Complete",,"This class includes only complete fire control systems. Anything less than a complete system, such as individual end items, assemblies, parts, attachments, or accessories for use in fire control systems are classified in classes other than this class.",
1240,4,OPTICAL SIGHTING AND RANGING EQUIPMENT,2011-10-01,,Optical Sighting and Ranging Equipment,,,Periscopes for Submarines; Range and Height  Finders; Telescopic Sights;  Optical Instruments Integrated with Fire Control Equipment.
1250,4,FIRE CONTROL STABILIZING MECHANISMS,1978-10-15,,Fire Control Stabilizing Mechanisms,,,
1260,4,FIRE CONTROL DESIGNATING AND INDICATING EQUIPMENT,2011-10-01,,Fire Control Designating and Indicating Equipment,,,"Turret, Gun, Torpedo Mount, and Searchlight Indicating Equipment; Target Designating Equipment; Synchro Systems."
1265,4,"FIRE CONTROL TRANSMITTING AND RECEIVING EQUIPMENT, EXCEPT AIRBORNE",2011-10-01,,"Fire Control Transmitting and Receiving Equipment, except Airborne","Fire Control Transmitting and Receiving Equipment, Specially Designed for use on or with Fire Control Radar Equipment.",,"Fire Control Transmitters, Transmitter-Receivers, Receivers, Receiver-Regulators."
1270,4,AIRCRAFT GUNNERY FIRE CONTROL COMPONENTS,2011-10-01,,Aircraft Gunnery Fire Control Components,Gun Chargers; Ammunition Boxes; Gun Heaters; Field and Link Chutes; Ammunition Boosters; Gyro Components; Complete Fire Control Systems.,,"Turrets, Aircraft; Computers, specifically designed; Complete Gyro Mechanisms."
1280,4,AIRCRAFT BOMBING FIRE CONTROL COMPONENTS,2011-10-01,,Aircraft Bombing Fire Control Components,"Gyro Components; Optical Elements, such as Lens, Prisms, Filters.",,"Computers, specifically designed; Complete Gyro Mechanisms; Optical Instruments for Bombing Fire Control."
1285,4,"FIRE CONTROL RADAR EQUIPMENT, EXCEPT AIRBORNE",2011-10-01,,"Fire Control Radar Equipment, except Airborne",,,"Radar Sets, Assemblies, Subassemblies, and Components Specially Designed for use on or with Fire Control Equipment."
1287,4,FIRE CONTROL SONAR EQUIPMENT,1979-01-15,,Fire Control Sonar Equipment,,"This class includes airborne, shipborne, and submarineborne sonar sets, assemblies, subassemblies, and components designed specifically for use with underwater fire control equipment.",
1290,4,MISCELLANEOUS FIRE CONTROL EQUIPMENT,2011-10-01,,Miscellaneous Fire Control Equipment,,,Fuze Setters; Ordnance Cable Systems;  Aiming Circles; Flash and Sound Ranging Sets; Fire  Control Components and Subassemblies Not Classifiable in other classes of group 12.
13,2,AMMUNITION AND EXPLOSIVES,1979-10-01,,,,Excluded from this group are items specially designed for nuclear ordnance application.,
1305,4,"AMMUNITION, THROUGH 30MM",2011-10-01,,"Ammunition, through 30 mm",,,Components.
1310,4,"AMMUNITION, OVER 30MM UP TO 75MM",2011-10-01,,"Ammunition, over 30 mm up to 75 mm",Fuzes and Primers.,,"Components, except Fuzes and Primers; Chemical Warfare Cartridges."
1315,4,"AMMUNITION, 75MM THROUGH 125MM",2011-10-01,,"Ammunition, 75 mm through 125 mm.",Fuzes and Primers.,,Components except Fuzes and Primers; Pyrotechnic Cartridges and Projectiles; Chemical Warfare Cartridges and Projectiles
1320,4,"AMMUNITION, OVER 125MM",2011-10-01,,"Ammunition, over 125 mm",Fuzes and Primers.,,"Components, except Fuzes and Primers; Chemical  Warfare Projectiles."
1325,4,BOMBS,1978-11-15,,Bombs,,,Components; Photoflash Bombs; Chemical Warfare Bombs; Bomb Clusters.
1330,4,GRENADES,1978-10-15,,Grenades,Firing Devices (Launchers).,,Components; Hand and Rifle Grenades; Smoke Grenades.
1336,4,GUIDED MISSILE WARHEADS AND EXPLOSIVE COMPONENTS,2011-10-01,,Guided Missile Warheads and Explosive Components,"Atomic Ordnance Warheads; All other Warheads for use on other than guided missiles; Liquid Propulsion Units; Rocket Engines (Liquid Propellent Units); JATO Units; Rocket Motors (Solid Propellant Units) for Guided Missiles; Solid Fuel Propulsion Units; Propellant Chemicals encased in consumable containers, such as squibs and cartridges for insertion into missile propulsion systems as integral parts.",,"Warheads Containing Military Chemical Agents; Exercise Heads, Guided Missile."
1337,4,"GUIDED MISSILE AND SPACE VEHICLE EXPLOSIVE PROPULSION UNITS, SOLID FUEL; AND COMPONENTS",2011-10-01,,"Guided Missile and Space Vehicle Explosive Propulsion Units, Solid Fuel; and components","Rocket Motors (Solid Propellant Units) for Guided Missiles, Inert-Loaded or Empty; All Inert (Nonexplosive) Components for Guided Missile and Space Vehicle Solid Fuel Propulsion Units; Guided Missile Warheads and Components; Rocket Propulsion Units; Rocket Motors (Solid Propellent Units) for Rockets; Solid Propellants predetermined to specific quantity and quality, but packaged in reusable containers.",,"Rocket Motors (Solid Propellant Units) for Guided Missiles, Explosive- Loaded; All Explosive Components for Guided Missile and Space Vehicle Solid Fuel Propulsion Units; Solid Propellants encased in consumable containers, such as squibs and cartridges, intended for insertion into missile propulsion systems as integral parts."
1338,4,"GUIDED MISSILE AND SPACE VEHICLE INERT PROPULSION UNITS, SOLID FUEL; AND COMPONENTS",2011-10-01,,"Guided Missile and Space Vehicle Inert Propulsion Units, Solid Fuel; and components","Rocket Motors (Solid Propellant Units) for Guided Missiles, Explosive-Loaded; Guided Missile Warheads and Components; Rocket Propulsion Units; Rocket Motors (Solid Propellant Units) for Rockets.",,"Rocket Motors (Solid Propellant Units) for guided Missiles, Inert-Loaded or Empty; All Inert  (Nonexplosive) Components for Guided Missile and Space Vehicle Solid Fuel Propulsion Units."
1340,4,"ROCKETS, ROCKET AMMUNITION AND ROCKET COMPONENTS",2011-10-01,,"Rockets, Rocket Ammunition and Rocket Components","Nuclear rockets, Nuclear warheads; all other warheads for use on other than rockets; and rockets with built-in guiding devices.",,"Complete Rounds; Explosive Components,  Including Warheads; Pyrotechnic Rockets; Solid Fuel JATO Units; Rocket Motors (Solid Propellant Units) for Rockets; Covers, Protective Rocket Warhead; Jettisonable Rocket Launchers; Conditioning Kits and Sets, Controlled Environment; and other peculiar components which are not classified elsewhere."
1345,4,LAND MINES,1978-11-15,,Land Mines,,,Components; Antipersonnel Mines; Antitank Mines; Fuzes.
1346,4,REMOTE MUNITIONS,2005-05-01,,Munitions items-systems that are not held by the soldier but are deployed for future activation.,,,
1350,4,"UNDERWATER MINE AND COMPONENTS, INERT",2011-10-01,,Underwater Mine Inert Components,,,Parachute Packs; Inert Mine Cases; Booster Cans; Clock Delays; Clock Starters; Search Coils; Extenders.
1351,4,"UNDERWATER MINES AND COMPONENTS, EXPLOSIVE",2011-10-01,,Underwater Mine Explosive Components,,,Loaded Cases; Boosters; Detonators.
1352,4,UNDERWATER MINE DISPOSAL INERT DEVICES,2011-10-01,,Version of Underwater Mine Disposal Explosive Device without destructive charge.,"Torpedo Inert components, depth charges, and underwater mines.",Intended for underwater mine hunting and reconnaissance. May also be used for training purposes.,"Complete operating units, such as an underwater mine reconnaissance device, as well as component parts, practice, training, blank, and dummies."
1353,4,UNDERWATER MINE DISPOSAL EXPLOSIVE DEVICES,2011-10-01,,"Complete explosive devices, including destructive charge.","Underwater Mine Explosive Components (FSC 1351), Torpedo Explosive Components (FSC 1356), Military Chemical Agents (FSC 1365).","It is fired, guided to target and detonated from a vessel or other remote site.","Complete explosive device, including ammunition, detonating charge, and component parts."
1355,4,"TORPEDOS AND COMPONENTS, INERT",2011-10-01,,Torpedo Inert Components,,,
1356,4,"TORPEDOS AND COMPONENTS, EXPLOSIVE",2011-10-01,,Torpedo Explosive Components,,,Warheads; Boosters; Detonators.
1360,4,"DEPTH CHARGES AND COMPONENTS, INERT",2011-10-01,,Depth Charge Inert Components,,,Inert Firing Mechanisms; Pistols without Detonators; Extenders.
1361,4,"DEPTH CHARGES AND COMPONENTS, EXPLOSIVE",2011-10-01,,Depth Charge Explosive Components,,,Cases; Boosters; Detonator.
1365,4,MILITARY CHEMICAL AGENTS,1978-11-15,,Military Chemical Agents,Ammunition containing Military Chemical Agents.,,War Gases; Screening Smokes; Incendiary and thickening Agents; Signaling Smokes.
1367,4,"TACTICAL SETS, KITS, AND OUTFITS",2005-05-01,,"A collection of items, which are used for a specific purpose.",,"These sets, kits and outfits may include such items as uniforms, weapons, body armor, and the like. By themselves, each of these components belongs in an FSC other than 1367.",Each collection must include at least one item of ordnance classified in Group 13. Ordnance may be non-lethal (as defined in the Department of Defense Directive 3000.3)
1370,4,PYROTECHNICS,1978-10-15,,Pyrotechnics,Pyrotechnic Cartridges and Projectiles; Photoflash Bombs; Pyrotechnic Rockets.,,Flares; Signals; Fireworks; Pistol Rocket Signals.
1375,4,DEMOLITION MATERIALS,1978-11-15,,Demolition Materials,"Liquid Propellant Fuels and Oxidizers; Solid Propellants encased in consumable containers, for insertion into missile propulsion systems as integral parts; Guided Missile Explosive Devices; Safety-in-Flight Explosive Items and Devices such as, Impulse Cartridges, Delay Cartridges, Aircraft Ejection Seat Catapults, Aircraft Canopy Removers, and similar items, as shown in the indexes to the FSC; Solid Propellants, predetermined to specific quantity and quality, packaged in reusable containers; Nuclear Ordnance Components; Rocket and Guided Missile Motors, Warheads, and Propulsion Sections.",,"Items for construction, quarrying and demolition work such as Dynamite and other explosives packed in cylindrical paper cartridges or in bags, Demolition Charges; Blasting Caps; Blasting Time Fuses; Detonating Cord; Demolition Firing Devices; Booby Trap Mechanisms; Bangalore Torpedoes; Inert accessories and components such as Blasting Machines, Priming Adapters, and Detonating Cord Clips."
1376,4,BULK EXPLOSIVES,1978-12-15,,Bulk Explosives,"Liquid Propellant Fuels and Oxidizers; Solid Propellants encased in consumable containers, for insertion into missile propulsion systems as integral parts; Guided Missile Explosive Devices; Blasting and Demolition Materials; Safety-in-Flight Explosive Items and Devices such as Impulse Cartridges, Delay Cartridges, Aircraft Ejection Seat Catapults, Aircraft Canopy Removers; Rocket and Guided Missile Motors, Warheads, and Propulsion Sections; similar items, as shown in the indexes to the FSC.",,"Solid Propellants, predetermined to specific quantity and quality, packaged in reusable containers; Explosive Loaded Devices and Components as shown in the indexes to the FSC."
1377,4,CARTRIDGE AND PROPELLANT ACTUATED DEVICES AND COMPONENTS,2011-10-01,,Cartridge and Propellant Actuated Devices and Components,"Liquid Propellant Fuels and Oxidizers; Solid Propellants, encased in consumable containers for insertion into missile propulsion systems as an integral part; Guided Missile Explosive Devices; Bulk and Solid Propellants, predetermined to specific quantity and quality, packaged in reusable containers; Blasting and Demolition Materials; Rocket Motors, Warheads and Propulsion Sections for Rockets and Guided Missiles.","This class includes safety-in-flight explosive items, consisting of a quantity of propellant (either encased in a cartridge or in molded form) and a means of activation, designed to be inserted into or attached to one or more devices to provide the energy required to operate devices requiring a time delay, or not requiring a time delay, in their operating sequence.  Also included are devices designed to utilize energy generated by the items described above.","Impulse Cartridges; Delay Cartridges; Engine Starter Cartridges (explosive filled); Fire Extinguisher Cartridges (used to activate by remote control); Aircraft Ejection Seat Catapults; Rocket Motors (Solid Propellant Units) for Aircraft Ejection Seats; Aircraft Canopy Removers; Thrusters, propellant and cartridge actuated; Initiators; Explosive Bolts and Explosive Bolt Cartridges; Cutters, cartridge or propellant actuated, Reefing Line; Powder actuated Tool Cartridges; Explosive Loaded Devices and Components which are not specifically classified elsewhere."
1385,4,SURFACE USE EXPLOSIVE ORDNANCE DISPOSAL TOOLS AND EQUIPMENT,2011-10-01,,Surface Use Explosive Ordnance Disposal Tools and Equipment,Nonspecialized or common tools and equipment not developed exclusively for use by qualified EOD personnel; specialized demolition material; explosive loaded shaped charges.,This class includes only specialized tools and equipment developed for and used by qualified Explosive Ordnance Disposal (EOD) personnel.,Nonspecialized or common tools and equipment not developed exclusively for use by qualified EOD personnel; specialized demolition material; explosive loaded shaped charges.
1386,4,UNDERWATER USE EXPLOSIVE ORDNANCE DISPOSAL AND SWIMMER WEAPONS SYSTEMS TOOLS AND EQUIPMENT,2011-10-01,,Underwater Use Explosive Ordnance disposal and Swimmer Weapons Systems Tools and Equipment.,,"This class includes only specialized tools and equipment developed for and used by qualified Explosive Ordnance Disposal (EOD) personnel, Underwater Demolition Teams (UDT), and/or Sea-Air-Land (SEAL) personnel.  Excludes Nonspecialized or common tools not developed exclusively for use by qualified EOD, UDT, and/or SEAL personnel; specialized demolition material; explosive loaded shaped charges.",
1390,4,FUZES AND PRIMERS,1978-10-15,,Fuzes and Primers,"Fuzes and Primers for ammunition not classified in classes 1310, 1315, and 1320.","This class includes only fuzes and primers for use in ammunition classified in classes 1310, 1315, and 1320.","Fuzes and Primers for ammunition not classified in classes 1310, 1315, and 1320."
1395,4,MISCELLANEOUS AMMUNITION,1978-10-15,,Miscellaneous Ammunition,,,"Ammunition Shapes, such as Blanks, Disks, Slugs, Cups, and Rotating Bands (Shell Bands)."
1398,4,SPECIALIZED AMMUNITION HANDLING AND SERVICING EQUIPMENT,2011-10-01,,Specialized Ammunition Handling and Servicing Equipment.,Handling and servicing equipment specially designed for use on or with rocket and pyrotechnic launchers; Ammunition maintenance and repair shop specialized equipment; Handling equipment specially designed for aircraft or airfield use.,,Handling and servicing equipment specially designed for use on or with rockets and conventional ammunition.
14,2,GUIDED MISSLES,1979-10-01,,,,"This group includes missiles (with or without warheads or explosive components) incorporating mechanisms capable of altering normal flight paths.  Radar and infrared assemblies and components designed specifically for use with guided missiles are classified in the appropriate classes of this group.  Excluded from this group are case sections, nose cones, flare sections, center sections, warheads, explosive components, rockets, and auxiliary components of missiles and re-entry vehicles which are designed or constructed for  exclusive use with or for housing of nuclear warheads and/or warhead sections.  Also excluded are space vehicle nose cones and space capsules specifically designed to carry loads peculiar to space research and space travel",
1410,4,GUIDED MISSILES,1978-10-15,,Guided Missiles,,"This class includes only complete guided missiles,  with or without warheads and explosive components, whether in assembled or unassembled form.  End items, assemblies, parts, attachments, or accessories for use in or on guided missiles are classified in classes other than this class.","Complete Drones, initially designed as missiles, but converted to drone use."
