H353,4,INSPECTION- HARDWARE AND ABRASIVES,2011-10-01,,Inspection and Laboratory Services (except medical/dental): Hardware and Abrasives,Excludes: Medical and Dental Laboratory Services,,Includes: Commercial Testing and Laboratory Services
H354,4,INSPECTION- PREFABRICATED STRUCTURES  AND SCAFFOLDING,2011-10-01,,Inspection and Laboratory Services (except medical/dental): Prefabricated Structures  and Scaffolding,Excludes: Medical and Dental Laboratory Services,,Includes: Commercial Testing and Laboratory Services
H355,4,"INSPECTION- LUMBER, MILLWORK, PLYWOOD, AND VENEER",2011-10-01,,"Inspection and Laboratory Services (except medical/dental): Lumber, Millwork, Plywood, and Veneer",Excludes: Medical and Dental Laboratory Services,,Includes: Commercial Testing and Laboratory Services
H356,4,INSPECTION- CONSTRUCTION AND BUILDING MATERIALS,2011-10-01,,Inspection and Laboratory Services (except medical/dental): Construction and Building Materials,Excludes: Medical and Dental Laboratory Services,,Includes: Commercial Testing and Laboratory Services
H358,4,"INSPECTION- COMMUNICATION, DETECTION, AND COHERENT RADIATION EQUIPMENT",2011-10-01,,"Inspection and Laboratory Services (except medical/dental): Communication, Detection, and Coherent Radiation Equipment",Excludes: Medical and Dental Laboratory Services,,Includes: Commercial Testing and Laboratory Services
H359,4,INSPECTION- ELECTRICAL AND ELECTRONIC EQUIPMENT COMPONENTS,2011-10-01,,Inspection and Laboratory Services (except medical/dental): Electrical and Electronic Equipment Components,Excludes: Medical and Dental Laboratory Services,,Includes: Commercial Testing and Laboratory Services
H360,4,"INSPECTION- FIBER OPTICS MATERIALS, COMPONENTS, ASSEMBLIES, AND ACCESSORIES",2011-10-01,,"Inspection and Laboratory Services (except medical/dental): Fiber Optics Materials, Components, Assemblies, and Accessories",Excludes: Medical and Dental Laboratory Services,,Includes: Commercial Testing and Laboratory Services
H361,4,INSPECTION- ELECTRIC WIRE AND POWER DISTRIBUTION EQUIPMENT,2011-10-01,,"Inspection and Laboratory Services (except medical/dental): Electric Wire, and Power and Distribution Equipment",Excludes: Medical and Dental Laboratory Services,,Includes: Commercial Testing and Laboratory Services
H362,4,INSPECTION- LIGHTING FIXTURES AND LAMPS,2011-10-01,,Inspection and Laboratory Services (except medical/dental): Lighting Fixtures and Lamps,Excludes: Medical and Dental Laboratory Services,,Includes: Commercial Testing and Laboratory Services
H363,4,"INSPECTION- ALARM, SIGNAL, AND SECURITY DETECTION SYSTEMS",2011-10-01,,"Inspection and Laboratory Services (except medical/dental): Alarm, Signal, and Security Detection Systems",Excludes: Medical and Dental Laboratory Services,,Includes: Commercial Testing and Laboratory Services
H365,4,"INSPECTION- MEDICAL, DENTAL, AND VETERINARY EQUIPMENT AND SUPPLIES",2011-10-01,,"Inspection and Laboratory Services (except medical/dental): Medical, Dental, and Veterinary Equipment and Supplies",Excludes: Medical and Dental Laboratory Services,,Includes: Commercial Testing and Laboratory Services
H366,4,INSPECTION- INSTRUMENTS AND LABORATORY EQUIPMENT,2011-10-01,,Inspection and Laboratory Services (except medical/dental): Instruments and Laboratory Equipment,Excludes: Medical and Dental Laboratory Services,,Includes: Commercial Testing and Laboratory Services
H367,4,INSPECTION- PHOTOGRAPHIC EQUIPMENT,2011-10-01,,Inspection and Laboratory Services (except medical/dental): Photographic Equipment,Excludes: Medical and Dental Laboratory Services,,Includes: Commercial Testing and Laboratory Services
H368,4,INSPECTION- CHEMICALS AND CHEMICAL PRODUCTS,2011-10-01,,Inspection and Laboratory Services (except medical/dental): Chemicals and Chemical Products,Excludes: Medical and Dental Laboratory Services,,Includes: Commercial Testing and Laboratory Services
H369,4,INSPECTION- TRAINING AIDS AND DEVICES,2011-10-01,,Inspection and Laboratory Services (except medical/dental): Training Aids and Devices,Excludes: Medical and Dental Laboratory Services,,Includes: Commercial Testing and Laboratory Services
H370,4,INSPECTION- ADP EQUIPMENT/SOFTWARE/SUPPLIES/SUPPORT EQUIPMENT,2011-10-01,,"Inspection and Laboratory Services (except medical/dental): Automatic Data Processing Equipment (Including  Firmware), Software, Supplies and Support Equipment",Excludes: Medical and Dental Laboratory Services,,Includes: Commercial Testing and Laboratory Services
H371,4,INSPECTION- FURNITURE,2011-10-01,,Inspection and Laboratory Services (except medical/dental): Furniture,Excludes: Medical and Dental Laboratory Services,,Includes: Commercial Testing and Laboratory Services
H372,4,INSPECTION- HOUSEHOLD AND COMMERCIAL FURNISHINGS AND APPLIANCES,2011-10-01,,Inspection and Laboratory Services (except medical/dental): Household and Commercial Furnishings and Appliances,Excludes: Medical and Dental Laboratory Services,,Includes: Commercial Testing and Laboratory Services
H373,4,INSPECTION- FOOD PREPARATION AND SERVING EQUIPMENT,2011-10-01,,Inspection and Laboratory Services (except medical/dental): Food Preparation and Serving Equipment,Excludes: Medical and Dental Laboratory Services,,Includes: Commercial Testing and Laboratory Services
H374,4,"INSPECTION- OFFICE MACHINES, TEXT PROCESSING SYSTEMS, AND VISIBLE RECORD EQUIPMENT",2011-10-01,,"Inspection and Laboratory Services (except medical/dental): Office Machines, Text Processing Systems and Visible Record Equipment",Excludes: Medical and Dental Laboratory Services,,Includes: Commercial Testing and Laboratory Services
H375,4,INSPECTION- OFFICE SUPPLIES AND DEVICES,2011-10-01,,Inspection and Laboratory Services (except medical/dental): Office Supplies and Devices,Excludes: Medical and Dental Laboratory Services,,Includes: Commercial Testing and Laboratory Services
H376,4,"INSPECTION- BOOKS, MAPS, AND OTHER PUBLICATIONS",2011-10-01,,"Inspection and Laboratory Services (except medical/dental): Books, Maps, and Other Publications",Excludes: Medical and Dental Laboratory Services,,Includes: Commercial Testing and Laboratory Services
H377,4,INSPECTION- MUSICAL INST/PHONOGRAPH/HOME RADIO,2011-10-01,,"Inspection and Laboratory Services (except medical/dental): Musical Instruments, Phonographs, and Home Type Radios",Excludes: Medical and Dental Laboratory Services,,Includes: Commercial Testing and Laboratory Services
H378,4,INSPECTION- RECREATIONAL AND ATHLETIC EQUIPMENT,2011-10-01,,Inspection and Laboratory Services (except medical/dental): Recreational and Athletic Equipment,Excludes: Medical and Dental Laboratory Services,,Includes: Commercial Testing and Laboratory Services
H379,4,INSPECTION- CLEANING EQUIPMENT AND SUPPLIES,2011-10-01,,Inspection and Laboratory Services (except medical/dental): Cleaning Equipment and Supplies,Excludes: Medical and Dental Laboratory Services,,Includes: Commercial Testing and Laboratory Services
H380,4,"INSPECTION- BRUSHES, PAINTS, SEALERS, AND ADHESIVES",2011-10-01,,"Inspection and Laboratory Services (except medical/dental): Brushes, Paints, Sealers, and Adhesives",,,
H381,4,"INSPECTION- CONTAINERS, PACKAGING, AND PACKING SUPPLIES",2011-10-01,,"Inspection and Laboratory Services (except medical/dental): Containers, Packaging, and Packing Supplies",Excludes: Medical and Dental Laboratory Services,,Includes: Commercial Testing and Laboratory Services
H383,4,"INSPECTION- TEXTILES, LEATHER, FURS, APPAREL AND SHOE FINDINGS, TENTS AND FLAGS",2011-10-01,,"Inspection and Laboratory Services (except medical/dental): Textiles, Leather, Furs, Apparel and Shoe Findings, Tents and Flags",Excludes: Medical and Dental Laboratory Services,,Includes: Commercial Testing and Laboratory Services
H384,4,"INSPECTION- CLOTHING, INDIVIDUAL EQUIPMENT, AND INSIGNIA",2011-10-01,,"Inspection and Laboratory Services (except medical/dental): Clothing, Individual Equipment, and Insignia",Excludes: Medical and Dental Laboratory Services,,Includes: Commercial Testing and Laboratory Services
H385,4,INSPECTION- TOILETRIES,2011-10-01,,Inspection and Laboratory Services (except medical/dental): Toiletries,Excludes: Medical and Dental Laboratory Services,,Includes: Commercial Testing and Laboratory Services
H387,4,INSPECTION- AGRICULTURAL SUPPLIES,2011-10-01,,Inspection and Laboratory Services (except medical/dental): Agricultural Supplies,Excludes: Medical and Dental Laboratory Services,,Includes: Commercial Testing and Laboratory Services
H388,4,INSPECTION- LIVE ANIMALS,2011-10-01,,Inspection and Laboratory Services (except medical/dental): Live Animals,Excludes: Medical and Dental Laboratory Services,,Includes: Commercial Testing and Laboratory Services
H389,4,INSPECTION- SUBSISTENCE,2011-10-01,,Inspection and Laboratory Services (except medical/dental): Subsistence,Excludes: Medical and Dental Laboratory Services,,Includes: Commercial Testing and Laboratory Services
H391,4,"INSPECTION- FUELS, LUBRICANTS, OILS, AND WAXES",2011-10-01,,"Inspection and Laboratory Services (except medical/dental): Fuels, Lubricants, Oils, and Waxes",Excludes: Medical and Dental Laboratory Services,,Includes: Commercial Testing and Laboratory Services
H393,4,INSPECTION- NONMETALLIC FABRICATED MATERIALS,2011-10-01,,Inspection and Laboratory Services (except medical/dental): Nonmetallic Fabricated Materials,Excludes: Medical and Dental Laboratory Services,,Includes: Commercial Testing and Laboratory Services
H394,4,INSPECTION- NONMETALLIC CRUDE MATERIALS,2011-10-01,,Inspection and Laboratory Services (except medical/dental): Nonmetallic Crude Materials,Excludes: Medical and Dental Laboratory Services,,Includes: Commercial Testing and Laboratory Services
H395,4,"INSPECTION- METAL BARS, SHEETS, AND SHAPES",2011-10-01,,"Inspection and Laboratory Services (except medical/dental): Metal Bars, Sheets, and Shapes",Excludes: Medical and Dental Laboratory Services,,Includes: Commercial Testing and Laboratory Services
H396,4,"INSPECTION- ORES, MINERALS, AND THEIR PRIMARY PRODUCTS",2011-10-01,,"Inspection and Laboratory Services (except medical/dental): Ores, Minerals, and Their Primary Products",Excludes: Medical and Dental Laboratory Services,,Includes: Commercial Testing and Laboratory Services
H399,4,INSPECTION- MISCELLANEOUS,2011-10-01,,Inspection and Laboratory Services (except medical/dental): Miscellaneous,Excludes: Medical and Dental Laboratory Services,,Includes: Commercial Testing and Laboratory Services
H9,2,"OTHER QUALITY, TEST, INSPECT SVCS",1979-10-01,,,,,
H910,4,OTHER QC/TEST/INSPECT- WEAPONS,2011-10-01,,"Other Quality Control, Testing and Inspection Services: Weapons",,,
H911,4,OTHER QC/TEST/INSPECT- NUCLEAR ORDNANCE,2011-10-01,,"Other Quality Control, Testing and Inspection Services: Nuclear Ordnance",,,
H912,4,OTHER QC/TEST/INSPECT- FIRE CONTROL EQUIPMENT,2011-10-01,,"Other Quality Control, Testing and Inspection Services: Fire Control Equipment",,,
H913,4,OTHER QC/TEST/INSPECT- AMMUNITION AND EXPLOSIVES,2011-10-01,,"Other Quality Control, Testing and Inspection Services: Ammunition and Explosives",,,
H914,4,OTHER QC/TEST/INSPECT- GUIDED MISSILES,2011-10-01,,"Other Quality Control, Testing and Inspection Services: Guided Missiles",,,
H915,4,OTHER QC/TEST/INSPECT- AIRCRAFT AND AIRFRAME STRUCTURAL COMPONENTS,2011-10-01,,"Other Quality Control, Testing and Inspection Services: Aircraft and Airframe Structural Components",,,
H916,4,OTHER QC/TEST/INSPECT- AIRCRAFT COMPONENTS AND ACCESSORIES,2011-10-01,,"Other Quality Control, Testing and Inspection Services: Aircraft Components and Accessories",,,
H917,4,"OTHER QC/TEST/INSPECT- AIRCRAFT LAUNCHING, LANDING, AND GROUND HANDLING EQUIPMENT",2011-10-01,,"Other Quality Control, Testing and Inspection Services: Aircraft Launching, Landing, and Ground Handling Equipment",,,
H918,4,OTHER QC/TEST/INSPECT- SPACE VEHICLES,2011-10-01,,"Other Quality Control, Testing and Inspection Services: Space Vehicles",,,
H919,4,"OTHER QC/TEST/INSPECT- SHIPS, SMALL CRAFT, PONTOONS, AND FLOATING DOCKS",2011-10-01,,"Other Quality Control, Testing and Inspection Services: Ships, Small Craft, Pontoons, and Floating Docks",,,
H920,4,OTHER QC/TEST/INSPECT- SHIP AND MARINE EQUIPMENT,2011-10-01,,"Other Quality Control, Testing and Inspection Services: Ship and Marine Equipment",,,
H922,4,OTHER QC/TEST/INSPECT- RAILWAY EQUIPMENT,2011-10-01,,"Other Quality Control, Testing and Inspection Services: Railway Equipment",,,
H923,4,"OTHER QC/TEST/INSPECT- GROUND EFFECT VEHICLES, MOTOR VEHICLES, TRAILERS, AND CYCLES",2011-10-01,,"Other Quality Control, Testing and Inspection Services: Ground Effect Vehicles, Motor Vehicles, Trailers, and Cycles",,,
H924,4,OTHER QC/TEST/INSPECT- TRACTORS,2011-10-01,,"Other Quality Control, Testing and Inspection Services: Tractors",,,
H925,4,OTHER QC/TEST/INSPECT- VEHICULAR EQUIPMENT COMPONENTS,2011-10-01,,"Other Quality Control, Testing and Inspection Services: Vehicular Equipment Components",,,
H926,4,OTHER QC/TEST/INSPECT- TIRES AND TUBES,2011-10-01,,"Other Quality Control, Testing and Inspection Services: Tires and Tubes",,,
H928,4,"OTHER QC/TEST/INSPECT- ENGINES, TURBINES, AND COMPONENTS",2011-10-01,,"Other Quality Control, Testing and Inspection Services: Engines, Turbines, and Components",,,
H929,4,OTHER QC/TEST/INSPECT- ENGINE ACCESSORIES,2011-10-01,,"Other Quality Control, Testing and Inspection Services: Engine Accessories",,,
H930,4,OTHER QC/TEST/INSPECT- MECHANICAL POWER TRANSMISSION EQUIPMENT,2011-10-01,,"Other Quality Control, Testing and Inspection Services: Mechanical Power Transmission Equipment",,,
H931,4,OTHER QC/TEST/INSPECT- BEARINGS,2011-10-01,,"Other Quality Control, Testing and Inspection Services: Bearings",,,
H932,4,OTHER QC/TEST/INSPECT- WOODWORKING MACHINERY AND EQUIPMENT,2011-10-01,,"Other Quality Control, Testing and Inspection Services: Woodworking Machinery and Equipment",,,
H934,4,OTHER QC/TEST/INSPECT- METALWORKING MACHINERY,2011-10-01,,"Other Quality Control, Testing and Inspection Services: Metalworking Machinery",,,
H935,4,OTHER QC/TEST/INSPECT- SERVICE AND TRADE EQUIPMENT,2011-10-01,,"Other Quality Control, Testing and Inspection Services: Service and Trade Equipment",,,
H936,4,OTHER QC/TEST/INSPECT- SPECIAL INDUSTRY MACHINERY,2011-10-01,,"Other Quality Control, Testing and Inspection Services: Special Industry Machinery",,,
H937,4,OTHER QC/TEST/INSPECT- AGRICULTURAL MACHINERY AND EQUIPMENT,2011-10-01,,"Other Quality Control, Testing and Inspection Services: Agricultural Machinery and Equipment",,,
H938,4,"OTHER QC/TEST/INSPECT- CONSTRUCTION, MINING, EXCAVATING, AND HIGHWAY MAINTENANCE EQUIPMENT",2011-10-01,,"Other Quality Control, Testing and Inspection Services: Construction, Mining, Excavating, and Highway Maintenance Equipment",,,
H939,4,OTHER QC/TEST/INSPECT- MATERIALS HANDLING EQUIPMENT,2011-10-01,,"Other Quality Control, Testing and Inspection Services: Materials Handling Equipment",,,
H940,4,"OTHER QC/TEST/INSPECT- ROPE, CABLE, CHAIN, AND FITTINGS",2011-10-01,,"Other Quality Control, Testing and Inspection Services: Rope, Cable, Chain, and Fittings",,,
H941,4,"OTHER QC/TEST/INSPECT- REFRIGERATION, AIR CONDITIONING, AND AIR CIRCULATING EQUIPMENT",2011-10-01,,"Other Quality Control, Testing and Inspection Services: Refrigeration, Air Conditioning, and Air Circulating Equipment",,,
H942,4,OTHER QC/TEST/INSPECT- FIRE FIGHTING/RESCUE/SAFETY EQUIPMENT; ENVIRON PROTECT EQUIPMENT/MATLS,2011-10-01,,"Other Quality Control, Testing and Inspection Services: Fire Fighting, Rescue, and Safety Equipment; and Environmental Protection Equipment and Materials",,,
H943,4,OTHER QC/TEST/INSPECT- PUMPS AND COMPRESSORS,2011-10-01,,"Other Quality Control, Testing and Inspection Services: Pumps and Compressors",,,
H944,4,"OTHER QC/TEST/INSPECT- FURNACE, STEAM PLANT, AND DRYING EQUIPMENT; NUCLEAR REACTORS",2011-10-01,,"Other Quality Control, Testing and Inspection Services: Furnace, Steam Plant, and Drying Equipment; and Nuclear Reactors",,,
H945,4,"OTHER QC/TEST/INSPECT- PLUMBING, HEATING, AND WASTE DISPOSAL EQUIPMENT",2011-10-01,,"Other Quality Control, Testing and Inspection Services: Plumbing, Heating, and Waste Disposal Equipment",,,
H946,4,OTHER QC/TEST/INSPECT- WATER PURIFICATION AND SEWAGE TREATMENT EQUIPMENT,2011-10-01,,"Other Quality Control, Testing and Inspection Services: Water Purification and Sewage Treatment Equipment",,,
H947,4,"OTHER QC/TEST/INSPECT- PIPE, TUBING, HOSE, AND FITTINGS",2011-10-01,,"Other Quality Control, Testing and Inspection Services: Pipe, Tubing, Hose, and Fittings",,,
H948,4,OTHER QC/TEST/INSPECT- VALVES,2011-10-01,,"Other Quality Control, Testing and Inspection Services: Valves",,,
H949,4,OTHER QC/TEST/INSPECT- MAINTENANCE AND REPAIR SHOP EQUIPMENT,2011-10-01,,"Other Quality Control, Testing and Inspection Services: Maintenance and Repair Shop Equipment",,,
H951,4,OTHER QC/TEST/INSPECT- HAND TOOLS,2011-10-01,,"Other Quality Control, Testing and Inspection Services: Hand Tools",,,
H952,4,OTHER QC/TEST/INSPECT- MEASURING TOOLS,2011-10-01,,"Other Quality Control, Testing and Inspection Services: Measuring Tool",,,
H953,4,OTHER QC/TEST/INSPECT- HARDWARE AND ABRASIVES,2011-10-01,,"Other Quality Control, Testing and Inspection Services: Hardware and Abrasives",,,
H954,4,OTHER QC/TEST/INSPECT- PREFABRICATED STRUCTURES  AND SCAFFOLDING,2011-10-01,,"Other Quality Control, Testing and Inspection Services: Prefabricated Structures  and Scaffolding",,,
H955,4,"OTHER QC/TEST/INSPECT- LUMBER, MILLWORK, PLYWOOD, AND VENEER",2011-10-01,,"Other Quality Control, Testing and Inspection Services: Lumber, Millwork, Plywood, and Veneer",,,
H956,4,OTHER QC/TEST/INSPECT- CONSTRUCTION AND BUILDING MATERIALS,2011-10-01,,"Other Quality Control, Testing and Inspection Services: Construction and Building Materials",,,
H958,4,"OTHER QC/TEST/INSPECT- COMMUNICATION, DETECTION, AND COHERENT RADIATION EQUIPMENT",2011-10-01,,"Other Quality Control, Testing and Inspection Services: Communication, Detection, and Coherent Radiation Equipment",,,
H959,4,OTHER QC/TEST/INSPECT- ELECTRICAL AND ELECTRONIC EQUIPMENT COMPONENTS,2011-10-01,,"Other Quality Control, Testing and Inspection Services: Electrical and Electronic Equipment Components",,,
H960,4,"OTHER QC/TEST/INSPECT- FIBER OPTICS MATERIALS, COMPONENTS, ASSEMBLIES, AND ACCESSORIES",2011-10-01,,"Other Quality Control, Testing and Inspection Services: Fiber Optics Materials, Components, Assemblies, and Accessories",,,
H961,4,OTHER QC/TEST/INSPECT- ELECTRIC WIRE AND POWER DISTRIBUTION EQUIPMENT,2011-10-01,,"Other Quality Control, Testing and Inspection Services: Electric Wire, and Power and Distribution Equipment",,,
H962,4,OTHER QC/TEST/INSPECT- LIGHTING FIXTURES AND LAMPS,2011-10-01,,"Other Quality Control, Testing and Inspection Services: Lighting Fixtures and Lamps",,,
H963,4,"OTHER QC/TEST/INSPECT- ALARM, SIGNAL, AND SECURITY DETECTION SYSTEMS",2011-10-01,,"Other Quality Control, Testing and Inspection Services: Alarm, Signal, and Security Detection Systems",,,
H965,4,"OTHER QC/TEST/INSPECT- MEDICAL, DENTAL, AND VETERINARY EQUIPMENT AND SUPPLIES",2011-10-01,,"Other Quality Control, Testing and Inspection Services: Medical, Dental, and Veterinary Equipment and Supplies",,,
H966,4,OTHER QC/TEST/INSPECT- INSTRUMENTS AND LABORATORY EQUIPMENT,2011-10-01,,"Other Quality Control, Testing and Inspection Services: Instruments and Laboratory Equipment",,,
H967,4,OTHER QC/TEST/INSPECT- PHOTOGRAPHIC EQUIPMENT,2011-10-01,,"Other Quality Control, Testing and Inspection Services: Photographic Equipment",,,
H968,4,OTHER QC/TEST/INSPECT- CHEMICALS AND CHEMICAL PRODUCTS,2011-10-01,,"Other Quality Control, Testing and Inspection Services: Chemicals and Chemical Products",,,
H969,4,OTHER QC/TEST/INSPECT- TRAINING AIDS AND DEVICES,2011-10-01,,"Other Quality Control, Testing and Inspection Services: Training Aids and Devices",,,
H970,4,OTHER QC/TEST/INSPECT- ADP EQUIPMENT/SOFTWARE/SUPPLIES/SUPPORT EQUIPMENT,2011-10-01,,"Other Quality Control, Testing and Inspection Services: Automatic Data Processing Equipment (Including  Firmware), Software, Supplies and Support Equipment",,,
H971,4,OTHER QC/TEST/INSPECT- FURNITURE,2011-10-01,,"Other Quality Control, Testing and Inspection Services: Furniture",,,
H972,4,OTHER QC/TEST/INSPECT- HOUSEHOLD AND COMMERCIAL FURNISHINGS AND APPLIANCES,2011-10-01,,"Other Quality Control, Testing and Inspection Services: Household and Commercial Furnishings and Appliances",,,
H973,4,OTHER QC/TEST/INSPECT- FOOD PREPARATION AND SERVING EQUIPMENT,2011-10-01,,"Other Quality Control, Testing and Inspection Services: Food Preparation and Serving Equipment",,,
H974,4,"OTHER QC/TEST/INSPECT- OFFICE MACHINES, TEXT PROCESSING SYSTEMS, AND VISIBLE RECORD EQUIPMENT",2011-10-01,,"Other Quality Control, Testing and Inspection Services: Office Machines, Text Processing Systems and Visible Record Equipment",,,
H975,4,OTHER QC/TEST/INSPECT- OFFICE SUPPLIES AND DEVICES,2011-10-01,,"Other Quality Control, Testing and Inspection Services: Office Supplies and Devices",,,
H976,4,"OTHER QC/TEST/INSPECT- BOOKS, MAPS, AND OTHER PUBLICATIONS",2011-10-01,,"Other Quality Control, Testing and Inspection Services: Books, Maps, and Other Publications",,,
H977,4,OTHER QC/TEST/INSPECT- MUSICAL INST/PHONOGRAPH/HOME RADIO,2011-10-01,,"Other Quality Control, Testing and Inspection Services: Musical Instruments, Phonographs, and Home Type Radios",,,
H978,4,OTHER QC/TEST/INSPECT- RECREATIONAL AND ATHLETIC EQUIPMENT,2011-10-01,,"Other Quality Control, Testing and Inspection Services: Recreational and Athletic Equipment",,,
H979,4,OTHER QC/TEST/INSPECT- CLEANING EQUIPMENT AND SUPPLIES,2011-10-01,,"Other Quality Control, Testing and Inspection Services: Cleaning Equipment and Supplies",,,
H980,4,"OTHER QC/TEST/INSPECT- BRUSHES, PAINTS, SEALERS, AND ADHESIVES",2011-10-01,,"Other Quality Control, Testing and Inspection Services: Brushes, Paints, Sealers, and Adhesives",,,
H981,4,"OTHER QC/TEST/INSPECT- CONTAINERS, PACKAGING, AND PACKING SUPPLIES",2011-10-01,,"Other Quality Control, Testing and Inspection Services: Containers, Packaging, and Packing Supplies",,,
H983,4,"OTHER QC/TEST/INSPECT- TEXTILES, LEATHER, FURS, APPAREL AND SHOE FINDINGS, TENTS AND FLAGS",2011-10-01,,"Other Quality Control, Testing and Inspection Services: Textiles, Leather, Furs, Apparel and Shoe Findings, Tents and Flags",,,
H984,4,"OTHER QC/TEST/INSPECT- CLOTHING, INDIVIDUAL EQUIPMENT, AND INSIGNIA",2011-10-01,,"Other Quality Control, Testing and Inspection Services: Clothing, Individual Equipment, and Insignia",,,
H985,4,OTHER QC/TEST/INSPECT- TOILETRIES,2011-10-01,,"Other Quality Control, Testing and Inspection Services: Toiletries",,,
H987,4,OTHER QC/TEST/INSPECT- AGRICULTURAL SUPPLIES,2011-10-01,,"Other Quality Control, Testing and Inspection Services: Agricultural Supplies",,,
H988,4,OTHER QC/TEST/INSPECT- LIVE ANIMALS,2011-10-01,,"Other Quality Control, Testing and Inspection Services: Live Animals",,,
H989,4,OTHER QC/TEST/INSPECT- SUBSISTENCE,2011-10-01,,"Other Quality Control, Testing and Inspection Services: Subsistence",,,
H991,4,"OTHER QC/TEST/INSPECT- FUELS, LUBRICANTS, OILS, AND WAXES",2011-10-01,,"Other Quality Control, Testing and Inspection Services: Fuels, Lubricants, Oils, and Waxes",,,
H993,4,OTHER QC/TEST/INSPECT- NONMETALLIC FABRICATED MATERIALS,2011-10-01,,"Other Quality Control, Testing and Inspection Services: Nonmetallic Fabricated Materials",,,
H994,4,OTHER QC/TEST/INSPECT- NONMETALLIC CRUDE MATERIALS,2011-10-01,,"Other Quality Control, Testing and Inspection Services: Nonmetallic Crude Materials",,,
H995,4,"OTHER QC/TEST/INSPECT- METAL BARS, SHEETS, AND SHAPES",2011-10-01,,"Other Quality Control, Testing and Inspection Services: Metal Bars, Sheets, and Shapes",,,
H996,4,"OTHER QC/TEST/INSPECT- ORES, MINERALS, AND THEIR PRIMARY PRODUCTS",2011-10-01,,"Other Quality Control, Testing and Inspection Services: Ores, Minerals, and Their Primary Products",,,
H999,4,OTHER QC/TEST/INSPECT- MISCELLANEOUS,2011-10-01,,"Other Quality Control, Testing and Inspection Services: Miscellaneous",,,
J,1,"MAINT, REPAIR, REBUILD EQUIPMENT",1979-10-01,,,,,
J0,2,"MAINT, REPAIR, REBUILD OF EQUIPMENT",1979-10-01,,,,,
J010,4,MAINT/REPAIR/REBUILD OF EQUIPMENT- WEAPONS,2011-10-01,,"Maintenance, Repair and Rebuilding of Equipment: Weapons",,,
J011,4,MAINT/REPAIR/REBUILD OF EQUIPMENT- NUCLEAR ORDNANCE,2011-10-01,,"Maintenance, Repair and Rebuilding of Equipment: Nuclear Ordnance",,,
J012,4,MAINT/REPAIR/REBUILD OF EQUIPMENT- FIRE CONTROL EQUIPMENT,2011-10-01,,"Maintenance, Repair and Rebuilding of Equipment: Fire Control Equipment",,,
J013,4,MAINT/REPAIR/REBUILD OF EQUIPMENT- AMMUNITION AND EXPLOSIVES,2011-10-01,,"Maintenance, Repair and Rebuilding of Equipment: Ammunition and Explosives",,,
J014,4,MAINT/REPAIR/REBUILD OF EQUIPMENT- GUIDED MISSILES,2011-10-01,,"Maintenance, Repair and Rebuilding of Equipment: Guided Missiles",,,
J015,4,MAINT/REPAIR/REBUILD OF EQUIPMENT- AIRCRAFT AND AIRFRAME STRUCTURAL COMPONENTS,2011-10-01,,"Maintenance, Repair and Rebuilding of Equipment: Aircraft and Airframe Structural Components",,,
J016,4,MAINT/REPAIR/REBUILD OF EQUIPMENT- AIRCRAFT COMPONENTS AND ACCESSORIES,2011-10-01,,"Maintenance, Repair and Rebuilding of Equipment: Aircraft Components and Accessories",,,
J017,4,"MAINT/REPAIR/REBUILD OF EQUIPMENT- AIRCRAFT LAUNCHING, LANDING, AND GROUND HANDLING EQUIPMENT",2011-10-01,,"Maintenance, Repair and Rebuilding of Equipment: Aircraft Launching, Landing, and Ground Handling Equipment",,,
J018,4,MAINT/REPAIR/REBUILD OF EQUIPMENT- SPACE VEHICLES,2011-10-01,,"Maintenance, Repair and Rebuilding of Equipment: Space Vehicles",,,
J019,4,"MAINT/REPAIR/REBUILD OF EQUIPMENT- SHIPS, SMALL CRAFT, PONTOONS, AND FLOATING DOCKS",2011-10-01,,"Maintenance, Repair and Rebuilding of Equipment: Ships, Small Craft, Pontoons, and Floating Docks",,,
