58,2,COMM/DETECT/COHERENT RADIATION,1979-10-01,,,,"Excludes oscillator items which should be classified in FSC 5955 or 5963; fiber optic items which should be classified in Group 60; electronic  modules as defined under Class 5963; and electrical  cable, cord and wire assemblies, harnesses and sets,   related to FSG 58 equipment (see FSC 5995).  In group  58, more than in any other group, it frequently happens  that the same name is listed as an index entry in each  of several classes.  In addition, that name may also  appear as an entry in groups other than 58.  Each such  entry refers to a distinctly different part or assembly, even though the different items have the same name. The listing of the same name in two or more classes  indicates that, in one form, the part or assembly  covered by the name is applicable to the equipment  covered by one class, and in another form is  applicable to the equipment covered by another  class.  For example, the item name CODER, AUDIO  FREQUENCY is applicable to two distinctly different assemblies, one of which has an application in  cryptologic equipment, covered by class 5810,  and the other in radar equipment covered by class 5840. Consequently the name CODER, AUDIO FREQUENCY is an entry  under each of the two classes.  When an item identification bears a name which  is indexed under more than one class of group 58, or in group 58 and in some other group, the item will be classified in the same class as its next  higher assembly in the manner described in the  Department of Defense, Federal Logistics Information System (FLIS) Procedures Manual, DoD 4100.39-M.  Also excluded from this group are data transmission and communications equipment such as terminals, sensors, and other devices designed for use with a configuration of ADPE.",
5805,4,TELEPHONE AND TELEGRAPH EQUIPMENT,1978-10-15,,Telephone and Telegraph Equipment,,,
5810,4,COMMUNICATIONS SECURITY EQUIPMENT AND COMPONENTS,2011-10-01,,Communications Security Equipment and Components,,,
5811,4,OTHER CRYPTOLOGIC EQUIPMENT AND COMPONENTS,2011-10-01,,Other Cryptologic Equipment and Components,,,
5815,4,TELETYPE AND FACSIMILE EQUIPMENT,1978-10-15,,Teletype and Facsimile Equipment,,,Ticker Tape and Sigtot Equipment.
5820,4,"RADIO AND TELEVISION COMMUNICATION EQUIPMENT, EXCEPT AIRBORNE",2011-10-01,,"Radio and Television Communication Equipment,  Except Airborne",Home Type Radio and Television Equipment.,,Telemetering Equipment.
5821,4,"RADIO AND TELEVISION COMMUNICATION EQUIPMENT, AIRBORNE",2011-10-01,,"Radio and Television Communication Equipment, Airborne",,,Telemetering Equipment.
5825,4,"RADIO NAVIGATION EQUIPMENT, EXCEPT AIRBORNE",2011-10-01,,"Radio Navigation Equipment, Except Airborne",,,Loran Equipment; Shoran Equipment; Direction Finding Equipment.
5826,4,"RADIO NAVIGATION EQUIPMENT, AIRBORNE",2011-10-01,,"Radio Navigation Equipment, Airborne",,,Loran Equipment; Shoran Equipment; Direction Finding Equipment.
5830,4,"INTERCOMMUNICATION AND PUBLIC ADDRESS SYSTEMS, EXCEPT AIRBORNE",2011-10-01,,"Intercommunication and Public Address Systems,  Except Airborne",,,Wired Audio Systems; Office Type Systems;  Shipboard Systems; Tank Systems.
5831,4,"INTERCOMMUNICATION AND PUBLIC ADDRESS SYSTEMS, AIRBORNE",2011-10-01,,"Intercommunication and Public Address Systems, Airborne",,,
5835,4,SOUND RECORDING AND REPRODUCING EQUIPMENT,2011-10-01,,Sound Recording and Reproducing Equipment,"Phonographs, Home Type; Dictating Machines.",,"Phonographs, Home Type; Dictating Machines."
5836,4,VIDEO RECORDING AND REPRODUCING EQUIPMENT,2011-10-01,,Video Recording and Reproducing Equipment,,"This class includes, and is restricted to electronic video equipment such as video monitors, televisions, cameras, printers and recorders/ reproducers used with miscellaneous communication equipment.  Also included is associated equipment such as cleaners, splicers, rewinders, reels and tapes designed for use with video recording-reproducing equipment.  Excluded from the class is photographic type equipment (Group 67), ADP type computer monitors (Group 70), and video equipment which includes radio receivers/transmitters (properly classified in more specific classes in Group 58).",
5840,4,"RADAR EQUIPMENT, EXCEPT AIRBORNE",1978-10-15,,"Radar Equipment, Except Airborne",,Radar assemblies and subassemblies designed  specifically for use with fire control equipment  or guided missiles are excluded from this class and are included in the appropriate classes of group 12  or group 14.,
5841,4,"RADAR EQUIPMENT, AIRBORNE",1978-10-15,,"Radar Equipment, Airborne",,Radar assemblies and subassemblies designed  specifically for use with fire control equipment or  guided missiles are excluded from this class and are  included in the appropriate classes of group 12 or  group 14.,
5845,4,UNDERWATER SOUND EQUIPMENT,1978-10-15,,Underwater Sound Equipment,,This class excludes items specifically designed for fire control sonar systems.,Sonar Equipment; Underwater Listening  Equipment; Sonobuoys; Sonobuoy Launchers; Fathometers; Sonar Equipment.
5850,4,VISIBLE AND INVISIBLE LIGHT COMMUNICATION EQUIPMENT,2011-10-01,,Visible and Invisible Light Communication Equipment,,"This class includes only communication types  of infrared equipment. Excluded from this class are infrared assemblies, subassemblies, and components  designed specifically for use in fire control systems,  guided missile systems, test and maintenance specialized equipment, night vision equipment, and other  noncommunication types of equipment.",Heliographs.
5855,4,"NIGHT VISION EQUIPMENT, EMITTED AND REFLECTED RADIATION",2011-10-01,,"Night Vision Equipment, Emitted and Reflected Radiation","Optical sighting devices which incorporate both day and night viewing characteristics within an  integral unit for fire control purposes, nonnight vision type items designed for use with guided missiles, communications, or laboratory equipment, and Optical  Elements, such, as Lens, Prisms, Windows.","This class includes image forming devices and  associated aids, their subassemblies and components,  utilizing passive and/or active techniques for detection,  observation, and identification of terrain and objects  at night, while maintaining concealment afforded by darkness.  Includes items having multiapplication for purposes of fire control, and/or night observation, and/or detection. Excluded from this class are items for which more specific classifications are suitable as prescribed by the structure and indexes  of the FSC.","Sighting and Observation Devices; Target Detectors, Locators, Remote Viewing Systems utilizing heat radiation emitted from object(s), associated Radiation Sources, Image Converters and Image Intensifiers, Optical Cells and other components designed for Night Vision Equipment.  Holders and Lens used with Infrared Equipment are also included in this FSC."
5860,4,"STIMULATED COHERENT RADIATION DEVICES, COMPONENTS, AND ACCESSORIES",2011-10-01,,"Stimulated Coherent Radiation Devices, Components,  and Accessories",,"This class includes, and is restricted to,  devices the operation of which is based on principles  involving the stimulated emission of radiation, and to associated components and accessories directly related  to stimulated coherent radiation techniques.  The methods  for producing the radiation are those obtained by LASER  (Light Amplification by Stimulated Emission of Radiation) and by MASER (Microwave and/or Molecular Amplification by  Stimulated Emission of Radiation) techniques.  Only those  items specifically designed for stimulated coherent radiation applications, and having no other application, are to be included in this class.  Assemblies or major systems containing such devices are excluded from this  class.",
5865,4,"ELECTRONIC COUNTERMEASURES, COUNTER-COUNTERMEASURES AND QUICK REACTION CAPABILITY EQUIPMENT",2011-10-01,,"Electronic Countermeasures, Counter-Countermeasures and Quick Reaction Capability Equipment",,"This class includes, and is restricted to, passive and active electronic equipment, systems, and subsystems designed to prevent or reduce an enemy's effective use of radiated electromagnetic energy or designed to insure our own effective use of radiated electromagnetic energy.","Electronic Countermeasures, Electronic Counter-Countermeasures, Electronic Support Measures, and Quick Reaction Capability Equipment and components specially designed therefor which are not classifiable elsewhere in the FSC structure.  Excluded from this class are nonelectronic items which are properly classified in more specific classes in accordance with the FSC structure and indexes."
5895,4,MISCELLANEOUS COMMUNICATION EQUIPMENT,2011-10-01,,Miscellaneous Communication Equipment,Electronic Countermeasures Equipment.,This class includes miscellaneous communication equipment that is not classified in more specific classes. (See the NOTE for FSG 58.),Modems.
59,2,ELECTRICAL/ELECTRONIC EQPT COMPNTS,1979-10-01,,,,"Mounting hardware, included in classes of this group, includes such  specially designed items as brackets, holders, retainers, etc.  Excluded from classes  in this group are such hardware items as screws (FSC 5305), bolts (FSC 5306), studs (FSC 5307), washers (FSC 5310), rivets (FSC 5320), and other common items  indexed to specific classes, other than in group 59.  The FSC indexes and structure  will govern the classification of items used on or with mounting hardware cited above.",
5905,4,RESISTORS,1978-10-15,,Resistors,Resistance Wire.,,Varistors; Resistive Ballast Tubes; Rheostats; Resistor  Networks; Resistor Mounting Hardware; Thermistors.
5910,4,CAPACITORS,1978-10-15,,Capacitors,Semiconductor Devices and Associated Hardware.,,Interference Filter Capacitors; Capacitor Mounting Hardware.
5915,4,FILTERS AND NETWORKS,1978-10-15,,Filters and Networks,,"This class includes those filters and networks which consist of a  combination of resistors, capacitors, or coils, but not a combination of resistors  only (classified in 5905). capacitors only (classified in 5910), or coils only  (classified in 5950).",
5920,4,"FUSES, ARRESTORS, ABSORBERS, AND PROTECTORS",2011-10-01,,"Fuses, Arresters, Absorbers, and Protectors",Circuit Breakers.,,"Fuseholders; Fuse Boxes; Fuse Posts; Fuse Links; Fuse blocks;  Current Limiters.  Corona Balls, Electrostatic Dischargers."
5925,4,CIRCUIT BREAKERS,1978-10-15,,Circuit Breakers,Relays.,,Circuit Breakers and Cutouts.
5930,4,SWITCHES,1978-10-15,,Switches,Switchgear.,,"Rotary, Knife, Toggle.  Push Button, Mercury, Thermostatic,  and Differential Pressure Switches."
5935,4,"CONNECTORS, ELECTRICAL",1978-10-15,,"Connectors, Electrical","Interconnectors, Fiber Optic.",,Plugs; Jacks; Receptacles; Electronic Component Sockets and Associated Accessories.
5940,4,"LUGS, TERMINALS, AND TERMINAL STRIPS",2011-10-01,,"Lugs, Terminals, and Terminal Strips","Caps, Electrical; Clips Electrical; and Contacts, Electrical.",,Binding Posts; Battery Clips; Stud Terminals; Test Clips.
5945,4,RELAYS AND SOLENOIDS,1978-10-15,,Relays and Solenoids,Contactors.,,Electromagnetic Actuators.
5950,4,COILS AND TRANSFORMERS,1978-10-15,,Coils and Transformers,,,"Coils, except ignition and magneto; coil assemblies; magnetic amplifiers; reactors; transformers."
5955,4,OSCILLATORS AND PIEZOELECTRIC CRYSTALS,2011-10-01,,Oscillators and Piezoelectric Crystals,"Crystal Controlled Oscillators and Noncrystal Controlled Oscillators  which meet the definition of the term. ""electronic module"" as defined for FSC 5963 and Microcircuits.",,"Crystal Units, Processed Unmounted  Crystals, Crystal Controlled Oscillators and Noncrystal Controlled Oscillators."
5960,4,ELECTRON TUBES AND ASSOCIATED HARDWARE,2011-10-01,,Electron Tubes and Associated Hardware,Transistors; Tube Sockets; X-ray Tubes; Semiconductor Devices and Associated Hardware.,,Rectifying Tubes; Photoelectric Tubes; Electron Vibrator Tubes.
5961,4,SEMICONDUCTOR DEVICES AND ASSOCIATED HARDWARE,2011-10-01,,Semiconductor Devices and Associated Hardware,Microcircuits; Optoelectronic Devices and Associated Hardware.,,"Semiconductor Assemblies; Semiconductor Diodes; Semiconductor Rectifiers, Semiconductor Thyristors; Transistors; Unitized Semiconductors; Associated Hardware except Sockets."
5962,4,"MICROCIRCUITS, ELECTRONIC",1978-10-15,,"Microcircuits, Electronic",Single Circuit Elements such as Capacitors; Resistors; Diodes and Transistors; Printed Circuit Boards and- Circuit Card Assemblies; and Filters and Networks.,"(1) A microcircuit is defined as follows:  A small circuit having  a high equivalent circuit element density, which is considered as a single part  composed of interconnected elements placed and/or formed on or within a single  substrate to perform an electronic circuit function.  The elements may be  on or within a semiconductor material substrate; may consist of conductive film(s) formed on an insulating substrate; or may be a combination of one or both of these types with discrete elements. (2) The term ""microcircuit"", as applied to circuit devices included in this class, is delimited to exclude items consisting  solely of interconnected ""microcomponents"" (discrete miniaturized components).   Also excluded are items fabricated in the form of monolithic thick-film or thin-film structures that in themselves are not functional electronic circuits   (e.g., capacitors, resistors, transistors, or ""arrays"" thereof).","Integrated Circuit Devices; Integrated Circuit Modules; Integrated Electronic Devices: Hybrid, Magnetic, Molecular, Opto-Electronic, and Thin Film."
5963,4,ELECTRONIC MODULES,1980-03-15,,Electronic Modules,Microcircuits; Electronic Test Equipment Plug-In Units.,"The term ""electronic module"" as used in this class designates an electronic component designed for use in various equipment or end item  applications, and capable of controlling voltage and/or current to produce  gain, oscillation, switching or similar integral electronic functions.  It consists of a collection of miniaturized electronic parts and/or elements in a  single replaceable package with plug-in mounting which will also complete the  required electrical connections.  It is not normally subject to disassembly as  distinguished from such items as CIRCUIT CARD ASSEMBLY and  ELECTRONIC COMPONENTS ASSEMBLY.  These modules conform to  industry or government specifications/standards that define all physical  dimensions and electrical parameters required to promote commonality and  ensure proper operational performance.",Microcircuits; Electronic Test Equipment Plug-In Units.
5965,4,"HEADSETS, HANDSETS, MICROPHONES AND SPEAKERS",2011-10-01,,"Headsets, Handsets, Microphones and Speakers",,,
5970,4,ELECTRICAL INSULATORS AND INSULATING MATERIALS,2011-10-01,,Electrical Insulators and Insulating Materials,,,"Tube, Knob, Cleat, Strain, and Standoff Insulators; Feed Thru  Insulators; Bead Insulators; Varnish Cambrie Tape; Friction Tape."
5975,4,ELECTRICAL HARDWARE AND SUPPLIES,1978-10-15,,Electrical Hardware and Supplies,,,"Conduit; Raceways; Face Plates; Condulets; Outlet and Junction Boxes; Pole Line Hardware, not elsewhere classifiable."
5977,4,ELECTRICAL CONTACT BRUSHES AND ELECTRODES,2011-10-01,,Electrical Contact Brushes and Electrodes,"Anodes; Cathodes, Welding Electrodes.",,Brushes for electrical rotating equipment; Carbon Stock for Brushes; Brush Arm and Holders; Lighting Electrodes.
5980,4,OPTOELECTRONIC DEVICES AND ASSOCIATED HARDWARE,2011-10-01,,Optoelectronic Devices and Associated Hardware,"Electric lighting fixtures, lamps, and associated hardware.",,"Optoelectronic devices and assemblies which display numeric, alphanumeric, symbolic, or graphic information emitters, and nondisplay optoelectronic  devices, such as couplers, detectors, and switches which perform an active function in an  electronic system."
5985,4,"ANTENNAS, WAVEGUIDES, AND RELATED EQUIPMENT",2011-10-01,,"Antennas, Waveguide, and Related Equipment",Tower Structures.,,Aerials; Mast; Tower Equipment; Attenuators; Couplers; Transmission Lines.
5990,4,SYNCHROS AND RESOLVERS,1978-10-15,,Synchros and Resolvers,Synchro Systems; Servo Mechanisms.,,Synchro Systems; Servo Mechanisms.
5995,4,"CABLE, CORD, AND WIRE ASSEMBLIES: COMMUNICATION EQUIPMENT",2011-10-01,,"Cable, Cord, and Wire Assemblies: Communication Equipment","Cable Assemblies, Fiber Optic","This class includes only those types of cable, cord, and wire  assemblies and sets (and wiring harnesses) used on or  with equipment  and components covered by groups 58 and 59. Cable, cord, wire assemblies,  and sets (wiring harnesses) used on or with equipment classified in FSC groups  other than groups 58 or 59 are classified in FSC class 6150 if multiapplication, or classified with the next higher classifiable assembly if specially designed.","Cable Assemblies, Fiber Optic"
5996,4,AMPLIFIERS,1991-10-01,,Amplifiers,"Multi-functional items such as Amplifier-Detector, Amplifier-Mixer and microcircuit devices.",,"Audio Amplifiers, Complementary Amplifiers, Amplifiers, Operational Amplifiers, Power Amplifiers, Radio Frequency Amplifiers, Signal Amplifiers, and Video Amplifiers."
5998,4,"ELECTRICAL AND ELECTRONIC ASSEMBLIES, BOARDS, CARDS, AND ASSOCIATED HARDWARE",2011-10-01,,"Electrical and Electronic Assemblies; Boards, Cards, and Associated Hardware",circuit card and electronic component assemblies which can be identified to a more definitive Approved Item Name.,,circuit card and electronic component assemblies which can be identified to a more definitive Approved Item Name.
5999,4,MISCELLANEOUS ELECTRICAL AND ELECTRONIC COMPONENTS,2011-10-01,,Miscellaneous Electrical and Electronic Components,,,"Permanent Magnets and Magnetostriction Elements; Caps, Clips, and Contacts, Electrical."
60,2,FIBER OPTIC,1979-10-01,,,,"Fiber Optics is a general term used to describe the function where optical energy (i.e., light/laser driven rays) is guided to another location through fiber(s).  This group includes Fiber Optics items such as parts, materials, and devices used for communications, data transmission, or  illumination.  Excludes Imaging devices under FSG 65 (Medical); hand tools under FSG 51;  Electrical, Electronic and Optical Instruments under FSG 66 (Instruments).",
6010,4,FIBER OPTIC CONDUCTORS,1981-02-15,,Fiber Optic Conductors,,Included in this class are bulk discrete fibers.,
6015,4,FIBER OPTIC CABLES,1980-09-15,,Fiber Optic Cables,,Included in this class are one or more discrete fiber optic conductors with  a common protective covering in bulk form.  May include electrical conductors/cables and/or reinforcing material.,
6020,4,FIBER OPTIC CABLE ASSEMBLIES AND HARNESSES,2011-10-01,,Fiber Optic Cable Assemblies and Harnesses,,Included in this class are items used for communication and/or data transmission having one or more fiber optic conductors/cables with processed  end(s) or terminated in fitting(s).  Excluded from this class are items used for illumination and/or image transmission.,
6021,4,FIBER OPTIC SWITCHES,1991-10-01,,Fiber Optic Switches,,Included in this class are switches used for line selection in fiber  optic systems.,
6030,4,FIBER OPTIC DEVICES,1980-07-15,,Fiber Optic Devices,,"Included in this class are such items as transmitters, receivers, mutliplexers, demultiplexers, modulators, demodulators, repeaters, attenuators, filters, integrated optical circuits, and the like, used in fiber optic systems.",
6032,4,FIBER OPTIC LIGHT SOURCES AND PHOTO DETECTORS,2011-10-01,,Fiber Optic Light Sources and Photo Detectors,,Included in this class are light emitting and laser diodes and photo detectors used in fiber optic systems.,
6035,4,FIBER OPTIC LIGHT TRANSFER AND IMAGE TRANSFER DEVICES,2011-10-01,,Fiber Optic Light Transfer and Image Transfer Devices,,Included in this class are fiber optic devices used for illumination  and/or image transmission.  Excluded from this class are items used for  communication and/or data transmission.,
6060,4,FIBER OPTIC INTERCONNECTORS,1981-07-15,,Fiber Optic Interconnectors,Electrical connectors,"Included in this class are all types of fiber optic terminations, such as connectors, dividers, couplers, rotary and nonrotary joints, splitters, mixers and splicers and the like.",Electrical connectors
6070,4,FIBER OPTIC ACCESSORIES AND SUPPLIES,2011-10-01,,Fiber Optic Accessories and Supplies,,"Included in this class are mode stripping materials, index matching materials and other related supplies.  Excluded from this class are hardware and supplies common to both electrical and fiber optic applications which are classifiable in FSC 5975.",
6080,4,FIBER OPTIC KITS AND SETS,1981-05-15,,Fiber Optic Kits and Sets,tool kits and sets which are classifiable in FSC 5180; test set/ instruments  classifiable in FSG 66; and end item sets/ equipment utilizing fiber optic components which are classifiable in the applicable equipment FSC.,"Includes kits and sets which consists of fiber optic components only; fiber optic components and related parts; fiber optic components and related tools; or fiber optic components, related parts and related tools.",tool kits and sets which are classifiable in FSC 5180; test set/ instruments  classifiable in FSG 66; and end item sets/ equipment utilizing fiber optic components which are classifiable in the applicable equipment FSC.
6099,4,MISCELLANEOUS FIBER OPTIC COMPONENTS,2011-10-01,,Miscellaneous Fiber Optic Components,,"Included in this, class are fiber optic items which are not  classifiable in a more specific class. (See the ""Note"" for FSG 60.)",
61,2,"ELECTRIC WIRE, POWER DISTRIB EQPT",1979-10-01,,,,,
6105,4,"MOTORS, ELECTRICAL",1978-10-15,,"Motors, Electrical",Starting Motors for Engines,,Starting Motors for Engines
6110,4,ELECTRICAL CONTROL EQUIPMENT,1978-10-15,,Electrical Control Equipment,Automatic Pilot Mechanisms; Relays; Resistors.,,Contactors:  Motor Controllers; Power Servomechanisms; Switchgear; Voltage Regulators.
6115,4,"GENERATORS AND GENERATOR SETS, ELECTRICAL",2011-10-01,,"Generators and Generator Sets, Electrical",Motor-Converters: Motor-Generator Sets; Engine Generators; Engine Accessory Generators.,,"Engine, Turbine, Wind, and Hand Driven Generator Sets and  Auxiliary Aircraft Generators."
6116,4,"FUEL CELL POWER UNITS, COMPONENTS, AND ACCESSORIES",2011-10-01,,"Fuel Cell Power Units, Components, and Accessories",Primary Batteries (FSC 6135); Secondary Batteries (FSC 6140); Generators and Generating Sets (FSC 6115); and items for which more suitable classes are specifically prescribed by the indexes and structure of the FSC.,"This class includes items that are designed to produce an electromotive  force directly from an oxidation-reduction type of chemical reaction.  A complete  power unit must include tanks, pumps, and associated control equipment, and  requires a continuous, uninterrupted supply of liquid or gaseous fuel and oxidizers.","Complete Functioning Fuel Cell Power Units; Fuel Cells: Fuel Cell Assemblies or Modules; Fuel Cell Reactant Chambers; Fuel Feed Mechanism; Electrolyte Heaters; Heat Exchangers; and other internal components peculiar to, and used exclusively  on or with, Fuel Cell Power Units classified in this class."
6117,4,SOLAR ELECTRIC POWER SYSTEMS,1991-07-15,,Solar Electric Power Systems,,This class includes items which are designed for the direct conversion  of solar energy into electrical power.,
6120,4,TRANSFORMERS: DISTRIBUTION AND POWER STATION,2011-10-01,,Transformers: Distribution and Power Station,Potential and Current Transformers.,This class includes transformers with a kilovolt-ampere rating  above  1 kva.,Potential and Current Transformers.
6125,4,"CONVERTERS, ELECTRICAL, ROTATING",1978-10-15,,"Converters, Electrical, Rotating",Nonrotating Equipment.,"This class includes devices employing mechanical rotation of changing electrical energy from one form to another (i.e., AC to AC, DC to DC, AC to DC,  DC to AC).  Excluded from this class are electrical generators and generator sets (FSC 6115).","Complete Battery Charging Equipment, Rotating; Dynamotors; Motor Converters; Motor-Generator Sets; Phase Converters; Rotating Equipment; Synchronous Converters."
6130,4,"CONVERTERS, ELECTRICAL, NONROTATING",1978-10-15,,"Converters, Electrical, Nonrotating",Rectifying Tubes; (FSC 5960); Rectifying Crystals (FSC 5961); Rotating Equipment (FSC 6125); Transformers (FSC 5950); and Semiconductor Devices and Associated Hardware (FSC 5961).,"This class includes devices employing a means other than mechanical rotation for changing electrical energy from one form to another (i.e., AC to AC, DC to DC, AC to DC, and DC to AC).","Complete Battery Charging Equipment, Nonrotating; Power Sup-plies, Multiapplication."
6135,4,"BATTERIES, NONRECHARGEABLE",1978-10-15,,"Batteries, Nonrechargeable",,,Cells and Dry Batteries; Nuclear Batteries.
6140,4,"BATTERIES, RECHARGEABLE",1978-10-15,,"Batteries, Rechargeable",,,Rechargeable Cells and Batteries.
6145,4,"WIRE AND CABLE, ELECTRICAL",1978-10-15,,"Wire and Cable, Electrical",Radio Frequency Transmission Line (FSC 5985); Fiber Optic Cable (FSC 6015); Communication Cable Assemblies; (FSC 5995); Distribution and Power Transmission Cable Assemblies (FSC 6150).,"This class includes only bulk electrical wire and cable.  Excluded  from this class are electrical wire and cable items of definite length either with  processed ends, or terminated in fittings","Insulated and Noninsulated, Wire and Cable, such as, Antenna Wire,  Coaxial Cable, Fuse and Resistance Wire, and Magnet Wire."
6150,4,MISCELLANEOUS ELECTRIC POWER AND DISTRIBUTION EQUIPMENT,2011-10-01,,Miscellaneous Electric Power and Distribution Equipment,,,"Appliance and Extension Cords; Electric Power and Distribution Cable with Attachments, Multiapplication; Common Components of Electrical Rotating Equipment, such as End Bells and Frames."
